luis,"no, no, no, no doubt, no doubt. okay, so im at this art museum with my cousin ignacio, right? and there was this, like, abstract expressionism exhibit, but you know me, im more like a neo-cubist kind of guy, right? but there was this one rothko that was sublime, bro. oh, my god…"
scott lang,luis.
scott lang,"oh, no."
scott lang,and? whatd he say?
luis,he said yes.
narrator,mid-credit scene; hank brings hope down to his lab
dr. hank pym,"theres something i want to show you. i realized you cant destroy power, all you can do is to make sure that its in the right hands. [he opens up a vault to reveal the prototype of the wasp suit] this is an advanced prototype that your mother and i worked on together. she never got to use it, but now i realize that we were… we were working on it for you. [hope looks at the suit in shock then back to pym] maybe its time we finished it. [hope looks back at the suit and smiles]"
hope van dyne,its about damn time.
narrator,post-credit scene
sam wilson,"hey, cap! [steve and sam are in an underground room with they are holding bucky barnes with his metal arm trapped in a vice] this would have been a lot easier a week ago."
steve rogers,if we call tony…
sam wilson,he wont believe us.
steve rogers,even if he did…
sam wilson,who knows if the accords will let him help?
steve rogers,were on our own.
sam wilson,maybe not. i know a guy.
narrator,the final screen text shows “ant-man will return”
